{
  "kind": "PlanBuildRequest",
  "resolved_pipeline_digest": "sha256:1111111111111111111111111111111111111111111111111111111111111111",
  "requested_profile": "bounded-reconstruction-graph",
  "scan_descriptor_digest": "sha256:2222222222222222222222222222222222222222222222222222222222222222",
  "target_envelope_digest": "sha256:3333333333333333333333333333333333333333333333333333333333333333",
  "machine_policy_digest": "sha256:4444444444444444444444444444444444444444444444444444444444444444",
  "node_planning_requirements": [
    {
      "node_id": "reconstruct",
      "requirements": {
        "execution": {
          "input_granularity": "frame",
          "partition_key": [],
          "max_active_keys": 1,
          "max_in_flight": 1,
          "max_items_per_activation": 1
        },
        "batch": {
          "min_items": 1,
          "preferred_items": 1,
          "max_items": 1,
          "max_charged_bytes": 1024
        },
        "rates": {
          "kind": "sdf",
          "static_phases": [
            {
              "inputs": [
                {"port_name": "input", "items": 1, "charged_bytes": 1024}
              ],
              "outputs": [
                {"port_name": "output", "items": 1, "charged_bytes": 1024}
              ]
            }
          ],
          "ordinary": {"outputs": []},
          "normal_flush": {"max_firings": 0, "outputs": []}
        },
        "resources": {
          "scratch_charged_bytes_per_firing": 0,
          "per_key_state_charged_bytes": 0,
          "per_scan_workspace_charged_bytes": 0,
          "retention_charged_bytes": 0,
          "output_items": 1,
          "output_charged_bytes": 1024,
          "cpu_permits": 1,
          "backend_gang_threads": 0,
          "provider_private_threads": 0,
          "external_allocation_charged_bytes": 0,
          "memory_domain": "host"
        },
        "calibration": {
          "role": "none",
          "binding_id": "",
          "max_active_keys": 0,
          "precalibration_horizon_items": 0,
          "precalibration_horizon_charged_bytes": 0,
          "max_calibration_frame_charged_bytes": 0,
          "max_decoder_staging_bytes": 0
        },
        "terminal": {
          "normal_max_output_items": 0,
          "normal_max_output_charged_bytes": 0,
          "normal_max_async_tokens": 0,
          "cancel_max_async_tokens": 0
        }
      }
    }
  ]
}
